item_id,name,price,category,description
1,Cheeseburger,12.99,Entree,UPDATED: Classic burger with cheddar cheese
2,Caesar Salad,9.99,Salad,UPDATED: Romaine lettuce with Caesar dressing
3,Margherita Pizza,14.99,Entree,UPDATED: Fresh mozzarella and basil
4,Chicken Wings,10.99,Appetizer,UPDATED: Spicy buffalo wings
5,Chocolate Cake,7.99,Dessert,UPDATED: Rich chocolate layer cake
6,French Fries,4.99,Side,UPDATED: Crispy golden fries
7,Soda,3.29,Beverage,UPDATED: Assorted soft drinks
8,Iced Tea,2.74,Beverage,UPDATED: Freshly brewed iced tea
